{
  "recordKind": "hacp.v0_3_candidate.consumption_receipt",
  "schemaVersion": "hacp-0.3-candidate",
  "receiptId": "receipt_example_claim_successor_001",
  "decisionId": "decision_example_approve_successor_001",
  "decisionDigest": {
    "algorithm": "sha256",
    "canonicalization": "json-rfc8785-jcs",
    "digestDomain": "io.hacp.human-decision.v0.3-candidate",
    "value": "545b43ca3c706c47090d953189d984506e6009a5efe5cfe03400edc0abcc0e0b"
  },
  "decisionRequest": {
    "kind": "review_finding",
    "id": "finding_example_needs_owner_decision_001",
    "digest": {
      "algorithm": "sha256",
      "canonicalization": "json-rfc8785-jcs",
      "digestDomain": "io.hacp.review-finding.v0.3-candidate",
      "value": "eb4f41e53bcbe6a6f8bada28db2b4397996c7b3e2dc4d9349e35d42c40f95c95"
    }
  },
  "claim": {
    "claimId": "claim_example_successor_001",
    "claimant": "agent:docs-worker@example.invalid",
    "claimedAt": "2026-09-03T18:05:00Z",
    "successorInvocationId": "invoke_example_docs_worker_001",
    "permittedScope": [
      "edit docs/source-packets/",
      "run docs/config validation",
      "return ACK and review evidence"
    ],
    "admissionResult": "accepted"
  },
  "singleConsumerBasis": {
    "profileId": "hacp-accountable-continuation-v0.3-candidate",
    "idempotencyKey": "example:decision:successor:001",
    "uniquenessRuleStatus": "requires_owner_approved_profile_definition",
    "trustedTimeSource": "profile-defined-owner-ledger",
    "receiptExpiresAt": "2026-09-03T19:00:00Z",
    "decisionValidityRef": "evidence://example/decision-validity",
    "receiptValidityRef": "evidence://example/receipt-validity"
  },
  "admittedBy": "role:admission-verifier@example.invalid",
  "evidenceRefs": [
    "evidence://example/issuer-admission-record",
    "evidence://example/human-approval-attestation"
  ],
  "digest": {
    "algorithm": "sha256",
    "canonicalization": "json-rfc8785-jcs",
    "digestDomain": "io.hacp.consumption-receipt.v0.3-candidate",
    "value": "826e13a192113d89e805ecd906d004cbe55e018e55721871d8c95a8a8f3d5bc1"
  },
  "boundaryStatement": "Illustrative acceptance only: issuer trust, uniqueness, and current-status policy require an independently approved profile. These hypothetical evidence references prove no actual admission. Accepted admission does not prove provider execution, external side effects, merge readiness, or exactly-once downstream completion."
}
