{
  "claim": {
    "claimId": "claim_wits_01a07ef6_c79c_7e65_9180_409d631fb27d",
    "claimant": "agent:wits-conformance@local",
    "claimedAt": "2026-09-08T03:01:37.308Z",
    "permittedScope": [
      "produce seven public-safe candidate records",
      "run local conformance validation"
    ],
    "admissionResult": "accepted",
    "successorInvocationId": "invoke_wits_hacp_v03_success_001"
  },
  "digest": {
    "value": "7ff4055a74cf3905acadddbeb46efd94ef259014da83ae791bf22968a94e122d",
    "algorithm": "sha256",
    "digestDomain": "io.hacp.consumption-receipt.v0.3-candidate",
    "canonicalization": "json-rfc8785-jcs"
  },
  "receiptId": "receipt_wits_01a07ef6_c79c_7e65_9180_409d631fb27d",
  "admittedBy": "wits:native-candidate-admission",
  "decisionId": "decision_wits_01a07ef6_c769_77ed_8e3e_ee694f1a8054",
  "recordKind": "hacp.v0_3_candidate.consumption_receipt",
  "evidenceRefs": [
    "wits://product-decision-action/01a07ef6-c6e4-7efb-b147-f1647b6070ed",
    "wits://candidate-authority/01a07ef6-c769-77ed-8e3e-ee694f1a8054"
  ],
  "schemaVersion": "hacp-0.3-candidate",
  "decisionDigest": {
    "value": "c98d362964b87981a1e1e5a035f7484dc8d97d17472f89b1561af45bd2d3f879",
    "algorithm": "sha256",
    "digestDomain": "io.hacp.human-decision.v0.3-candidate",
    "canonicalization": "json-rfc8785-jcs"
  },
  "decisionRequest": {
    "id": "finding_wits_01a07ef6_c6e4_7efb_b147_f1647b6070ed",
    "kind": "review_finding",
    "digest": {
      "value": "da8ee20af9c6c63c2a266ceef6ece477ea819572dca7e6bea0aa32e633550059",
      "algorithm": "sha256",
      "digestDomain": "io.hacp.review-finding.v0.3-candidate",
      "canonicalization": "json-rfc8785-jcs"
    }
  },
  "boundaryStatement": "WITS locally accepted one claim under a database uniqueness rule. This does not prove provider execution, external effects, or exactly-once completion.",
  "singleConsumerBasis": {
    "profileId": "hacp-accountable-continuation-v0.3-candidate",
    "idempotencyKey": "hacp-v03:consume:success",
    "receiptExpiresAt": "2026-09-08T03:16:37.133Z",
    "trustedTimeSource": "wits-postgresql-clock-timestamp",
    "receiptValidityRef": "wits://candidate-consumption/01a07ef6-c79c-7e65-9180-409d631fb27d",
    "decisionValidityRef": "wits://candidate-authority/01a07ef6-c769-77ed-8e3e-ee694f1a8054",
    "uniquenessRuleStatus": "requires_owner_approved_profile_definition"
  }
}
